"No.","Time","Source","Destination","Protocol","Length","Info"
"1","0.000000","0.0.0.0","255.255.255.255","DHCP","379","DHCP Request  - Transaction ID 0x6144ca1c"
"2","0.000340","192.168.1.1","192.168.1.216","DHCP","342","DHCP ACK      - Transaction ID 0x6144ca1c"
"3","0.088755","192.168.1.216","224.0.0.22","IGMPv3","54","Membership Report / Join group 224.0.0.251 for any sources"
"4","0.091166","192.168.1.216","224.0.0.22","IGMPv3","54","Membership Report / Join group 224.0.0.252 for any sources"
"5","0.102250","ASUSTekC_32:58:f9","Broadcast","ARP","42","Who has 192.168.1.216? (ARP Probe)"
"6","0.102389","192.168.1.216","224.0.0.22","IGMPv3","62","Membership Report / Join group 224.0.0.251 for any sources / Join group 224.0.0.252 for any sources"
"7","0.107325","192.168.1.216","224.0.0.22","IGMPv3","54","Membership Report / Leave group 224.0.0.252"
"8","0.107574","192.168.1.216","224.0.0.22","IGMPv3","54","Membership Report / Join group 224.0.0.252 for any sources"
"9","0.141964","192.168.1.216","224.0.0.251","MDNS","81","Standard query 0x0000 ANY DESKTOP-GXMYNO2.local, ""QM"" question"
"10","0.142784","192.168.1.216","224.0.0.251","MDNS","91","Standard query response 0x0000 A 192.168.1.216"
"11","0.151379","192.168.1.216","224.0.0.252","LLMNR","75","Standard query 0x661c ANY DESKTOP-GXMYNO2"
"12","0.414330","ASUSTekC_32:58:f9","Broadcast","ARP","42","Who has 192.168.1.1? Tell 192.168.1.216"
"13","0.414409","Cisco_f6:df:0a","ASUSTekC_32:58:f9","ARP","42","192.168.1.1 is at 1c:17:d3:f6:df:0a"
"14","0.467290","ASUSTekC_32:58:f9","Broadcast","ARP","42","Who has 192.168.1.2? Tell 192.168.1.216"
"15","0.467497","Dell_62:ae:26","ASUSTekC_32:58:f9","ARP","42","192.168.1.2 is at 20:47:47:62:ae:26"
"16","0.467602","192.168.1.216","192.168.1.2","DNS","95","Standard query 0xde0e SRV _ldap._tcp.dc._msdcs.spoonwatch.net"
"17","0.467862","192.168.1.2","192.168.1.216","DNS","159","Standard query response 0xde0e SRV _ldap._tcp.dc._msdcs.spoonwatch.net SRV 0 100 389 spoonwatch-dc.spoonwatch.net A 192.168.1.2"
"18","0.472526","192.168.1.216","192.168.1.2","DNS","88","Standard query 0x9dc7 A spoonwatch-dc.spoonwatch.net"
"19","0.472780","192.168.1.2","192.168.1.216","DNS","104","Standard query response 0x9dc7 A spoonwatch-dc.spoonwatch.net A 192.168.1.2"
"20","0.510432","192.168.1.216","192.168.1.2","CLDAP","264","searchRequest(1) ""<ROOT>"" baseObject "
"21","0.510779","192.168.1.2","192.168.1.216","CLDAP","232","searchResEntry(1) ""<ROOT>"" searchResDone(1) success  [1 result]"
"22","0.564200","192.168.1.216","192.168.1.2","DNS","107","Standard query 0xa1cc SRV _ldap._tcp.dc._msdcs.localdomain.spoonwatch.net"
"23","0.564502","192.168.1.2","192.168.1.216","DNS","182","Standard query response 0xa1cc No such name SRV _ldap._tcp.dc._msdcs.localdomain.spoonwatch.net SOA spoonwatch-dc.spoonwatch.net"
"24","0.564837","192.168.1.216","192.168.1.2","TCP","66","49668  >  389 [SYN] Seq=0 Win=64240 Len=0 MSS=1460 WS=256 SACK_PERM=1"
"25","0.564985","192.168.1.2","192.168.1.216","TCP","66","389  >  49668 [SYN, ACK] Seq=0 Ack=1 Win=65535 Len=0 MSS=1460 WS=256 SACK_PERM=1"
"26","0.565087","192.168.1.216","192.168.1.2","TCP","54","49668  >  389 [ACK] Seq=1 Ack=1 Win=2102272 Len=0"
"27","0.565441","192.168.1.216","192.168.1.2","LDAP","404","searchRequest(2) ""<ROOT>"" baseObject "
"28","0.565723","192.168.1.2","192.168.1.216","TCP","1514","389  >  49668 [ACK] Seq=1 Ack=351 Win=2102272 Len=1460 [TCP segment of a reassembled PDU]"
"29","0.565726","192.168.1.2","192.168.1.216","LDAP","1367","searchResEntry(2) ""<ROOT>""  | searchResDone(2) success  [1 result]"
"30","0.566029","192.168.1.216","192.168.1.2","TCP","54","49668  >  389 [ACK] Seq=351 Ack=2774 Win=2102272 Len=0"
"31","0.572235","192.168.1.216","192.168.1.2","DNS","107","Standard query 0xcc6a SRV _ldap._tcp.dc._msdcs.localdomain.spoonwatch.net"
"32","0.572517","192.168.1.2","192.168.1.216","DNS","182","Standard query response 0xcc6a No such name SRV _ldap._tcp.dc._msdcs.localdomain.spoonwatch.net SOA spoonwatch-dc.spoonwatch.net"
"33","0.602288","192.168.1.216","224.0.0.22","IGMPv3","54","Membership Report / Join group 224.0.0.252 for any sources"
"34","0.719384","192.168.1.216","192.168.1.1","NBNS","110","Registration NB SPOONWATCH<00>"
"35","0.719662","192.168.1.216","192.168.1.1","NBNS","110","Registration NB DESKTOP-GXNYNO2<00>"
"36","0.752925","192.168.1.216","192.168.1.2","CLDAP","264","searchRequest(1) ""<ROOT>"" baseObject "
"37","0.753237","192.168.1.2","192.168.1.216","CLDAP","232","searchResEntry(1) ""<ROOT>"" searchResDone(1) success  [1 result]"
"38","0.900476","ASUSTekC_32:58:f9","Broadcast","ARP","42","Who has 192.168.1.1? Tell 192.168.1.216"
"39","0.900550","Cisco_f6:df:0a","ASUSTekC_32:58:f9","ARP","42","192.168.1.1 is at 1c:17:d3:f6:df:0a"
"40","0.992148","192.168.1.216","192.168.1.2","TCP","66","49670  >  445 [SYN] Seq=0 Win=64240 Len=0 MSS=1460 WS=256 SACK_PERM=1"
"41","0.992368","192.168.1.2","192.168.1.216","TCP","66","445  >  49670 [SYN, ACK] Seq=0 Ack=1 Win=65535 Len=0 MSS=1460 WS=256 SACK_PERM=1"
"42","0.992513","192.168.1.216","192.168.1.2","TCP","54","49670  >  445 [ACK] Seq=1 Ack=1 Win=2102272 Len=0"
"43","0.996850","192.168.1.216","192.168.1.2","SMB","127","Negotiate Protocol Request"
"44","0.997297","192.168.1.2","192.168.1.216","SMB2","306","Negotiate Protocol Response"
"45","0.997457","192.168.1.216","192.168.1.2","SMB2","322","Negotiate Protocol Request"
"46","0.997787","192.168.1.2","192.168.1.216","SMB2","366","Negotiate Protocol Response"
"47","1.025321","192.168.1.216","192.168.1.2","TCP","66","49670  >  445 [ACK] Seq=342 Ack=565 Win=2101760 Len=0 SLE=253 SRE=565"
"48","1.102272","ASUSTekC_32:58:f9","Broadcast","ARP","42","Who has 192.168.1.216? (ARP Probe)"
"49","1.264561","192.168.1.216","192.168.1.2","DNS","76","Standard query 0xd5dc A dns.msftncsi.com"
"50","1.293993","192.168.1.2","192.168.1.216","DNS","92","Standard query response 0xd5dc A dns.msftncsi.com A 131.107.255.255"
"51","1.313086","192.168.1.216","192.168.1.1","NBNS","110","Registration NB DESKTOP-GXNYNO2<20>"
"52","1.454577","192.168.1.216","192.168.1.2","DNS","126","Standard query 0x8614 SRV _ldap._tcp.Default-First-Site-Name._sites.dc._msdcs.spoonwatch.net"
"53","1.454920","192.168.1.2","192.168.1.216","DNS","190","Standard query response 0x8614 SRV _ldap._tcp.Default-First-Site-Name._sites.dc._msdcs.spoonwatch.net SRV 0 100 389 spoonwatch-dc.spoonwatch.net A 192.168.1.2"
"54","1.464379","192.168.1.216","192.168.1.2","DNS","130","Standard query 0x0288 SRV _kerberos._tcp.Default-First-Site-Name._sites.dc._msdcs.spoonwatch.net"
"55","1.464706","192.168.1.2","192.168.1.216","DNS","194","Standard query response 0x0288 SRV _kerberos._tcp.Default-First-Site-Name._sites.dc._msdcs.spoonwatch.net SRV 0 100 88 spoonwatch-dc.spoonwatch.net A 192.168.1.2"
"56","1.540223","192.168.1.216","192.168.1.2","DNS","79","Standard query 0x5211 A wpad.spoonwatch.net"
"57","1.540596","192.168.1.2","192.168.1.216","DNS","154","Standard query response 0x5211 No such name A wpad.spoonwatch.net SOA spoonwatch-dc.spoonwatch.net"
"58","1.541766","192.168.1.216","192.168.1.2","DNS","76","Standard query 0x611a A wpad.localdomain"
"59","1.542023","192.168.1.2","192.168.1.216","DNS","151","Standard query response 0x611a No such name A wpad.localdomain SOA a.root-servers.net"
"60","1.639885","192.168.1.216","192.168.1.2","CLDAP","265","searchRequest(1) ""<ROOT>"" baseObject "
"61","1.640195","192.168.1.216","192.168.1.2","CLDAP","308","searchRequest(2) ""<ROOT>"" baseObject "
"62","1.640232","192.168.1.2","192.168.1.216","CLDAP","232","searchResEntry(1) ""<ROOT>"" searchResDone(1) success  [1 result]"
"63","1.640439","192.168.1.2","192.168.1.216","CLDAP","232","searchResEntry(2) ""<ROOT>"" searchResDone(2) success  [1 result]"
"64","1.642698","192.168.1.216","192.168.1.2","CLDAP","264","searchRequest(3) ""<ROOT>"" baseObject "
"65","1.643085","192.168.1.2","192.168.1.216","CLDAP","232","searchResEntry(3) ""<ROOT>"" searchResDone(3) success  [1 result]"
"66","1.649024","192.168.1.216","192.168.1.2","CLDAP","311","searchRequest(4) ""<ROOT>"" baseObject "
"67","1.649470","192.168.1.2","192.168.1.216","CLDAP","253","searchResEntry(4) ""<ROOT>"" searchResDone(4) success  [1 result]"
"68","1.683946","192.168.1.216","192.168.1.2","CLDAP","265","searchRequest(5) ""<ROOT>"" baseObject "
"69","1.684304","192.168.1.2","192.168.1.216","CLDAP","232","searchResEntry(5) ""<ROOT>"" searchResDone(5) success  [1 result]"
"70","1.686362","192.168.1.216","192.168.1.2","CLDAP","264","searchRequest(6) ""<ROOT>"" baseObject "
"71","1.686667","192.168.1.2","192.168.1.216","CLDAP","232","searchResEntry(6) ""<ROOT>"" searchResDone(6) success  [1 result]"
"72","1.756730","192.168.1.216","192.168.1.2","TCP","66","49673  >  88 [SYN] Seq=0 Win=64240 Len=0 MSS=1460 WS=256 SACK_PERM=1"
"73","1.756945","192.168.1.2","192.168.1.216","TCP","66","88  >  49673 [SYN, ACK] Seq=0 Ack=1 Win=65535 Len=0 MSS=1460 WS=256 SACK_PERM=1"
"74","1.757137","192.168.1.216","192.168.1.2","TCP","54","49673  >  88 [ACK] Seq=1 Ack=1 Win=2102272 Len=0"
"75","1.757311","192.168.1.216","192.168.1.2","KRB5","298","AS-REQ"
"76","1.757842","192.168.1.2","192.168.1.216","KRB5","278","KRB Error: KRB5KDC_ERR_PREAUTH_REQUIRED"
"77","1.758110","192.168.1.216","192.168.1.2","TCP","54","49673  >  88 [FIN, ACK] Seq=245 Ack=225 Win=2102016 Len=0"
"78","1.758272","192.168.1.2","192.168.1.216","TCP","54","88  >  49673 [ACK] Seq=225 Ack=246 Win=2102272 Len=0"
"79","1.758317","192.168.1.2","192.168.1.216","TCP","54","88  >  49673 [RST, ACK] Seq=225 Ack=246 Win=0 Len=0"
"80","1.765494","192.168.1.216","192.168.1.2","TCP","66","49674  >  135 [SYN] Seq=0 Win=64240 Len=0 MSS=1460 WS=256 SACK_PERM=1"
"81","1.765691","192.168.1.2","192.168.1.216","TCP","66","135  >  49674 [SYN, ACK] Seq=0 Ack=1 Win=65535 Len=0 MSS=1460 WS=256 SACK_PERM=1"
"82","1.765826","192.168.1.216","192.168.1.2","TCP","54","49674  >  135 [ACK] Seq=1 Ack=1 Win=262656 Len=0"
"83","1.767226","192.168.1.216","192.168.1.2","TCP","66","49675  >  135 [SYN] Seq=0 Win=64240 Len=0 MSS=1460 WS=256 SACK_PERM=1"
"84","1.767343","192.168.1.2","192.168.1.216","TCP","66","135  >  49675 [SYN, ACK] Seq=0 Ack=1 Win=65535 Len=0 MSS=1460 WS=256 SACK_PERM=1"
"85","1.767354","192.168.1.216","192.168.1.2","DCERPC","214","Bind: call_id: 2, Fragment: Single, 3 context items: EPMv4 V3.0 (32bit NDR), EPMv4 V3.0 (64bit NDR), EPMv4 V3.0 (6cb71c2c-9812-4540-0300-000000000000)"
"86","1.767530","192.168.1.216","192.168.1.2","TCP","54","49675  >  135 [ACK] Seq=1 Ack=1 Win=262656 Len=0"
"87","1.767549","192.168.1.2","192.168.1.216","DCERPC","162","Bind_ack: call_id: 2, Fragment: Single, max_xmit: 5840 max_recv: 5840, 3 results: Provider rejection, Acceptance, Negotiate ACK"
"88","1.768179","192.168.1.216","192.168.1.2","EPM","222","Map request, DRSUAPI, 32bit NDR"
"89","1.768182","192.168.1.216","192.168.1.2","DCERPC","214","Bind: call_id: 3, Fragment: Single, 2 context items: EPMv4 V3.0 (32bit NDR), EPMv4 V3.0 (64bit NDR)"
"90","1.768467","192.168.1.2","192.168.1.216","EPM","226","Map response, DRSUAPI, 32bit NDR"
"91","1.768534","192.168.1.2","192.168.1.216","DCERPC","138","Bind_ack: call_id: 3, Fragment: Single, max_xmit: 5840 max_recv: 5840, 2 results: Provider rejection, Acceptance"
"92","1.768681","192.168.1.216","192.168.1.2","EPM","222","Map request, RPC_NETLOGON, 32bit NDR"
"93","1.768911","192.168.1.2","192.168.1.216","EPM","322","Map response, RPC_NETLOGON, 32bit NDR, RPC_NETLOGON, 32bit NDR"
"94","1.769450","192.168.1.216","192.168.1.2","TCP","66","49676  >  49676 [SYN] Seq=0 Win=64240 Len=0 MSS=1460 WS=256 SACK_PERM=1"
"95","1.769599","192.168.1.2","192.168.1.216","TCP","66","49676  >  49676 [SYN, ACK] Seq=0 Ack=1 Win=65535 Len=0 MSS=1460 WS=256 SACK_PERM=1"
"96","1.769760","192.168.1.216","192.168.1.2","TCP","54","49676  >  49676 [ACK] Seq=1 Ack=1 Win=262656 Len=0"
"97","1.769835","192.168.1.216","192.168.1.2","DCERPC","214","Bind: call_id: 2, Fragment: Single, 3 context items: RPC_NETLOGON V1.0 (32bit NDR), RPC_NETLOGON V1.0 (64bit NDR), RPC_NETLOGON V1.0 (6cb71c2c-9812-4540-0300-000000000000)"
"98","1.769853","192.168.1.216","192.168.1.2","TCP","66","49677  >  49667 [SYN] Seq=0 Win=64240 Len=0 MSS=1460 WS=256 SACK_PERM=1"
"99","1.770044","192.168.1.2","192.168.1.216","TCP","66","49667  >  49677 [SYN, ACK] Seq=0 Ack=1 Win=65535 Len=0 MSS=1460 WS=256 SACK_PERM=1"
"100","1.770069","192.168.1.2","192.168.1.216","DCERPC","162","Bind_ack: call_id: 2, Fragment: Single, max_xmit: 5840 max_recv: 5840, 3 results: Provider rejection, Acceptance, Negotiate ACK"
"101","1.770298","192.168.1.216","192.168.1.2","TCP","54","49677  >  49667 [ACK] Seq=1 Ack=1 Win=2102272 Len=0"
"102","1.770307","192.168.1.216","192.168.1.2","RPC_NETLOGON","238","NetrServerReqChallenge request, "
"103","1.770629","192.168.1.2","192.168.1.216","RPC_NETLOGON","90","NetrServerReqChallenge response"
"104","1.770660","192.168.1.216","192.168.1.2","TCP","66","49678  >  88 [SYN] Seq=0 Win=64240 Len=0 MSS=1460 WS=256 SACK_PERM=1"
"105","1.770778","192.168.1.2","192.168.1.216","TCP","66","88  >  49678 [SYN, ACK] Seq=0 Ack=1 Win=65535 Len=0 MSS=1460 WS=256 SACK_PERM=1"
"106","1.770808","192.168.1.216","192.168.1.2","RPC_NETLOGON","306","NetrServerAuthenticate3 request"
"107","1.770899","192.168.1.216","192.168.1.2","TCP","54","49678  >  88 [ACK] Seq=1 Ack=1 Win=2102272 Len=0"
"108","1.770933","192.168.1.216","192.168.1.2","KRB5","298","AS-REQ"
"109","1.771417","192.168.1.2","192.168.1.216","KRB5","278","KRB Error: KRB5KDC_ERR_PREAUTH_REQUIRED"
"110","1.771582","192.168.1.216","192.168.1.2","TCP","54","49678  >  88 [FIN, ACK] Seq=245 Ack=225 Win=2102016 Len=0"
"111","1.771587","192.168.1.2","192.168.1.216","RPC_NETLOGON","98","NetrServerAuthenticate3 response"
"112","1.771675","192.168.1.2","192.168.1.216","TCP","54","88  >  49678 [ACK] Seq=225 Ack=246 Win=2102272 Len=0"
"113","1.771768","192.168.1.2","192.168.1.216","TCP","54","88  >  49678 [RST, ACK] Seq=225 Ack=246 Win=0 Len=0"
"114","1.771782","192.168.1.216","192.168.1.2","DCERPC","202","Alter_context: call_id: 4, Fragment: Single, 1 context items: RPC_NETLOGON V1.0 (64bit NDR)"
"115","1.771951","192.168.1.2","192.168.1.216","DCERPC","130","Alter_context_resp: call_id: 4, Fragment: Single, max_xmit: 5840 max_recv: 5840, 1 results: Acceptance"
"116","1.772120","192.168.1.216","192.168.1.2","RPC_NETLOGON","334","NetrLogonDummyRoutine1 request"
"117","1.772359","192.168.1.2","192.168.1.216","RPC_NETLOGON","174","NetrLogonDummyRoutine1 response"
"118","1.778917","192.168.1.216","192.168.1.2","RPC_NETLOGON","1022","NetrLogonGetDomainInfo request"
"119","1.779388","192.168.1.2","192.168.1.216","RPC_NETLOGON","1054","NetrLogonGetDomainInfo response"
"120","1.782639","192.168.1.216","192.168.1.2","TCP","66","49679  >  88 [SYN] Seq=0 Win=64240 Len=0 MSS=1460 WS=256 SACK_PERM=1"
"121","1.782641","192.168.1.216","192.168.1.2","TCP","66","49680  >  88 [SYN] Seq=0 Win=64240 Len=0 MSS=1460 WS=256 SACK_PERM=1"
"122","1.782782","192.168.1.2","192.168.1.216","TCP","66","88  >  49679 [SYN, ACK] Seq=0 Ack=1 Win=65535 Len=0 MSS=1460 WS=256 SACK_PERM=1"
"123","1.782820","192.168.1.2","192.168.1.216","TCP","66","88  >  49680 [SYN, ACK] Seq=0 Ack=1 Win=65535 Len=0 MSS=1460 WS=256 SACK_PERM=1"
"124","1.782976","192.168.1.216","192.168.1.2","TCP","54","49679  >  88 [ACK] Seq=1 Ack=1 Win=262656 Len=0"
"125","1.782979","192.168.1.216","192.168.1.2","TCP","54","49680  >  88 [ACK] Seq=1 Ack=1 Win=262656 Len=0"
"126","1.783034","192.168.1.216","192.168.1.2","KRB5","378","AS-REQ"
"127","1.783080","192.168.1.216","192.168.1.2","KRB5","378","AS-REQ"
"128","1.783779","192.168.1.2","192.168.1.216","TCP","1514","88  >  49679 [ACK] Seq=1 Ack=325 Win=2102272 Len=1460 [TCP segment of a reassembled PDU]"
"129","1.783782","192.168.1.2","192.168.1.216","KRB5","405","AS-REP"
"130","1.783819","192.168.1.2","192.168.1.216","TCP","1514","88  >  49680 [ACK] Seq=1 Ack=325 Win=2102272 Len=1460 [TCP segment of a reassembled PDU]"
"131","1.783820","192.168.1.2","192.168.1.216","KRB5","405","AS-REP"
"132","1.784004","192.168.1.216","192.168.1.2","TCP","54","49679  >  88 [ACK] Seq=325 Ack=1812 Win=262656 Len=0"
"133","1.784007","192.168.1.216","192.168.1.2","TCP","54","49680  >  88 [ACK] Seq=325 Ack=1812 Win=262656 Len=0"
"134","1.784056","192.168.1.216","192.168.1.2","TCP","54","49680  >  88 [FIN, ACK] Seq=325 Ack=1812 Win=262656 Len=0"
"135","1.784119","192.168.1.216","192.168.1.2","TCP","54","49679  >  88 [FIN, ACK] Seq=325 Ack=1812 Win=262656 Len=0"
"136","1.784148","192.168.1.2","192.168.1.216","TCP","54","88  >  49680 [ACK] Seq=1812 Ack=326 Win=2102272 Len=0"
"137","1.784307","192.168.1.2","192.168.1.216","TCP","54","88  >  49679 [ACK] Seq=1812 Ack=326 Win=2102272 Len=0"
"138","1.784339","192.168.1.2","192.168.1.216","TCP","54","88  >  49679 [RST, ACK] Seq=1812 Ack=326 Win=0 Len=0"
"139","1.784427","192.168.1.2","192.168.1.216","TCP","54","88  >  49680 [RST, ACK] Seq=1812 Ack=326 Win=0 Len=0"
"140","1.787179","192.168.1.216","192.168.1.2","EPM","222","Map request, DRSUAPI, 32bit NDR"
"141","1.787469","192.168.1.2","192.168.1.216","EPM","226","Map response, DRSUAPI, 32bit NDR"
"142","1.787749","192.168.1.216","192.168.1.2","TCP","66","49681  >  49667 [SYN] Seq=0 Win=64240 Len=0 MSS=1460 WS=256 SACK_PERM=1"
"143","1.787759","192.168.1.216","192.168.1.2","TCP","66","49682  >  88 [SYN] Seq=0 Win=64240 Len=0 MSS=1460 WS=256 SACK_PERM=1"
"144","1.787941","192.168.1.2","192.168.1.216","TCP","66","49667  >  49681 [SYN, ACK] Seq=0 Ack=1 Win=65535 Len=0 MSS=1460 WS=256 SACK_PERM=1"
"145","1.787961","192.168.1.2","192.168.1.216","TCP","66","88  >  49682 [SYN, ACK] Seq=0 Ack=1 Win=65535 Len=0 MSS=1460 WS=256 SACK_PERM=1"
"146","1.788098","192.168.1.216","192.168.1.2","TCP","54","49681  >  49667 [ACK] Seq=1 Ack=1 Win=2102272 Len=0"
"147","1.788101","192.168.1.216","192.168.1.2","KRB5","298","AS-REQ"
"148","1.788628","192.168.1.2","192.168.1.216","KRB5","278","KRB Error: KRB5KDC_ERR_PREAUTH_REQUIRED"
"149","1.788775","192.168.1.216","192.168.1.2","TCP","54","49682  >  88 [FIN, ACK] Seq=245 Ack=225 Win=262400 Len=0"
"150","1.788884","192.168.1.2","192.168.1.216","TCP","54","88  >  49682 [ACK] Seq=225 Ack=246 Win=2102272 Len=0"
"151","1.788920","192.168.1.216","192.168.1.2","TCP","66","49683  >  88 [SYN] Seq=0 Win=64240 Len=0 MSS=1460 WS=256 SACK_PERM=1"
"152","1.788950","192.168.1.2","192.168.1.216","TCP","54","88  >  49682 [RST, ACK] Seq=225 Ack=246 Win=0 Len=0"
"153","1.789080","192.168.1.2","192.168.1.216","TCP","66","88  >  49683 [SYN, ACK] Seq=0 Ack=1 Win=65535 Len=0 MSS=1460 WS=256 SACK_PERM=1"
"154","1.789225","192.168.1.216","192.168.1.2","TCP","54","49683  >  88 [ACK] Seq=1 Ack=1 Win=2102272 Len=0"
"155","1.789349","192.168.1.216","192.168.1.2","KRB5","379","AS-REQ"
"156","1.789898","192.168.1.2","192.168.1.216","TCP","1514","88  >  49683 [ACK] Seq=1 Ack=326 Win=2102272 Len=1460 [TCP segment of a reassembled PDU]"
"157","1.789901","192.168.1.2","192.168.1.216","KRB5","405","AS-REP"
"158","1.790079","192.168.1.216","192.168.1.2","TCP","54","49683  >  88 [ACK] Seq=326 Ack=1812 Win=2102272 Len=0"
"159","1.790100","192.168.1.216","192.168.1.2","TCP","54","49683  >  88 [FIN, ACK] Seq=326 Ack=1812 Win=2102272 Len=0"
"160","1.790205","192.168.1.2","192.168.1.216","TCP","54","88  >  49683 [ACK] Seq=1812 Ack=327 Win=2102272 Len=0"
"161","1.790257","192.168.1.2","192.168.1.216","TCP","54","88  >  49683 [RST, ACK] Seq=1812 Ack=327 Win=0 Len=0"
"162","1.790622","192.168.1.216","192.168.1.2","TCP","66","49684  >  88 [SYN] Seq=0 Win=64240 Len=0 MSS=1460 WS=256 SACK_PERM=1"
"163","1.790639","192.168.1.216","192.168.1.2","TCP","66","49685  >  88 [SYN] Seq=0 Win=64240 Len=0 MSS=1460 WS=256 SACK_PERM=1"
"164","1.790766","192.168.1.2","192.168.1.216","TCP","66","88  >  49684 [SYN, ACK] Seq=0 Ack=1 Win=65535 Len=0 MSS=1460 WS=256 SACK_PERM=1"
"165","1.790805","192.168.1.2","192.168.1.216","TCP","66","88  >  49685 [SYN, ACK] Seq=0 Ack=1 Win=65535 Len=0 MSS=1460 WS=256 SACK_PERM=1"
"166","1.790886","192.168.1.216","192.168.1.2","TCP","54","49684  >  88 [ACK] Seq=1 Ack=1 Win=2102272 Len=0"
"167","1.790909","192.168.1.216","192.168.1.2","TCP","54","49685  >  88 [ACK] Seq=1 Ack=1 Win=262656 Len=0"
"168","1.790950","192.168.1.216","192.168.1.2","TCP","1514","49684  >  88 [ACK] Seq=1 Ack=1 Win=2102272 Len=1460 [TCP segment of a reassembled PDU]"
"169","1.790952","192.168.1.216","192.168.1.2","KRB5","464","TGS-REQ"
"170","1.791074","192.168.1.216","192.168.1.2","TCP","1514","49685  >  88 [ACK] Seq=1 Ack=1 Win=262656 Len=1460 [TCP segment of a reassembled PDU]"
"171","1.791078","192.168.1.2","192.168.1.216","TCP","54","88  >  49684 [ACK] Seq=1 Ack=1871 Win=2102272 Len=0"
"172","1.791079","192.168.1.216","192.168.1.2","KRB5","448","TGS-REQ"
"173","1.791191","192.168.1.2","192.168.1.216","TCP","54","88  >  49685 [ACK] Seq=1 Ack=1855 Win=2102272 Len=0"
"174","1.791965","192.168.1.2","192.168.1.216","TCP","1514","88  >  49684 [ACK] Seq=1 Ack=1871 Win=2102272 Len=1460 [TCP segment of a reassembled PDU]"
"175","1.791968","192.168.1.2","192.168.1.216","KRB5","403","TGS-REP"
"176","1.792084","192.168.1.2","192.168.1.216","TCP","1514","88  >  49685 [ACK] Seq=1 Ack=1855 Win=2102272 Len=1460 [TCP segment of a reassembled PDU]"
"177","1.792087","192.168.1.2","192.168.1.216","KRB5","387","TGS-REP"
"178","1.792142","192.168.1.216","192.168.1.2","TCP","54","49684  >  88 [ACK] Seq=1871 Ack=1810 Win=2102272 Len=0"
"179","1.792240","192.168.1.216","192.168.1.2","TCP","54","49685  >  88 [ACK] Seq=1855 Ack=1794 Win=262656 Len=0"
"180","1.792276","192.168.1.216","192.168.1.2","TCP","54","49685  >  88 [FIN, ACK] Seq=1855 Ack=1794 Win=262656 Len=0"
"181","1.792368","192.168.1.216","192.168.1.2","TCP","54","49684  >  88 [FIN, ACK] Seq=1871 Ack=1810 Win=2102272 Len=0"
"182","1.792394","192.168.1.2","192.168.1.216","TCP","54","88  >  49685 [ACK] Seq=1794 Ack=1856 Win=2102272 Len=0"
"183","1.792476","192.168.1.2","192.168.1.216","TCP","54","88  >  49684 [ACK] Seq=1810 Ack=1872 Win=2102272 Len=0"
"184","1.792514","192.168.1.2","192.168.1.216","TCP","54","88  >  49684 [RST, ACK] Seq=1810 Ack=1872 Win=0 Len=0"
"185","1.792601","192.168.1.2","192.168.1.216","TCP","54","88  >  49685 [RST, ACK] Seq=1794 Ack=1856 Win=0 Len=0"
"186","1.793769","192.168.1.216","192.168.1.2","TCP","66","49686  >  389 [SYN] Seq=0 Win=64240 Len=0 MSS=1460 WS=256 SACK_PERM=1"
"187","1.793904","192.168.1.2","192.168.1.216","TCP","66","389  >  49686 [SYN, ACK] Seq=0 Ack=1 Win=65535 Len=0 MSS=1460 WS=256 SACK_PERM=1"
"188","1.794003","192.168.1.216","192.168.1.2","TCP","54","49686  >  389 [ACK] Seq=1 Ack=1 Win=262656 Len=0"
"189","1.794220","192.168.1.216","192.168.1.2","LDAP","404","searchRequest(7) ""<ROOT>"" baseObject "
"190","1.794474","192.168.1.2","192.168.1.216","TCP","1514","389  >  49686 [ACK] Seq=1 Ack=351 Win=2102272 Len=1460 [TCP segment of a reassembled PDU]"
"191","1.794476","192.168.1.2","192.168.1.216","LDAP","1367","searchResEntry(7) ""<ROOT>""  | searchResDone(7) success  [1 result]"
"192","1.794638","192.168.1.216","192.168.1.2","TCP","54","49686  >  389 [ACK] Seq=351 Ack=2774 Win=262656 Len=0"
"193","1.795339","192.168.1.216","192.168.1.2","TCP","66","49687  >  88 [SYN] Seq=0 Win=64240 Len=0 MSS=1460 WS=256 SACK_PERM=1"
"194","1.795475","192.168.1.2","192.168.1.216","TCP","66","88  >  49687 [SYN, ACK] Seq=0 Ack=1 Win=65535 Len=0 MSS=1460 WS=256 SACK_PERM=1"
"195","1.795582","192.168.1.216","192.168.1.2","TCP","54","49687  >  88 [ACK] Seq=1 Ack=1 Win=262656 Len=0"
"196","1.795696","192.168.1.216","192.168.1.2","TCP","1514","49687  >  88 [ACK] Seq=1 Ack=1 Win=262656 Len=1460 [TCP segment of a reassembled PDU]"
"197","1.795700","192.168.1.216","192.168.1.2","KRB5","243","TGS-REQ"
"198","1.795834","192.168.1.2","192.168.1.216","TCP","54","88  >  49687 [ACK] Seq=1 Ack=1650 Win=2102272 Len=0"
"199","1.796202","192.168.1.2","192.168.1.216","TCP","1514","88  >  49687 [ACK] Seq=1 Ack=1650 Win=2102272 Len=1460 [TCP segment of a reassembled PDU]"
"200","1.796206","192.168.1.2","192.168.1.216","KRB5","272","TGS-REP"
"201","1.796334","192.168.1.216","192.168.1.2","TCP","54","49687  >  88 [ACK] Seq=1650 Ack=1679 Win=262656 Len=0"
"202","1.796439","192.168.1.216","192.168.1.2","TCP","54","49687  >  88 [FIN, ACK] Seq=1650 Ack=1679 Win=262656 Len=0"
"203","1.796542","192.168.1.2","192.168.1.216","TCP","54","88  >  49687 [ACK] Seq=1679 Ack=1651 Win=2102272 Len=0"
"204","1.796602","192.168.1.2","192.168.1.216","TCP","54","88  >  49687 [RST, ACK] Seq=1679 Ack=1651 Win=0 Len=0"
"205","1.796939","192.168.1.216","192.168.1.2","TCP","1514","49670  >  445 [ACK] Seq=342 Ack=565 Win=2101760 Len=1460 [TCP segment of a reassembled PDU]"
"206","1.796941","192.168.1.216","192.168.1.2","TCP","1514","49670  >  445 [ACK] Seq=1802 Ack=565 Win=2101760 Len=1460 [TCP segment of a reassembled PDU]"
"207","1.796942","192.168.1.216","192.168.1.2","SMB2","824","Session Setup Request"
"208","1.797111","192.168.1.2","192.168.1.216","TCP","54","445  >  49670 [ACK] Seq=565 Ack=4032 Win=2102272 Len=0"
"209","1.797461","192.168.1.216","192.168.1.2","TCP","1514","49686  >  389 [ACK] Seq=351 Ack=2774 Win=262656 Len=1460 [TCP segment of a reassembled PDU]"
"210","1.797464","192.168.1.216","192.168.1.2","LDAP","663","bindRequest(9) ""<ROOT>"" sasl "
"211","1.797583","192.168.1.2","192.168.1.216","TCP","54","389  >  49686 [ACK] Seq=2774 Ack=2420 Win=2102272 Len=0"
"212","1.798093","192.168.1.2","192.168.1.216","SMB2","314","Session Setup Response"
"213","1.798142","192.168.1.2","192.168.1.216","LDAP","264","bindResponse(9) success "
"214","1.798591","192.168.1.216","192.168.1.2","SMB2","200","Tree Connect Request Tree: \\\\SPOONWATCH-DC.spoonwatch.net\\IPC$"
"215","1.798791","192.168.1.2","192.168.1.216","SMB2","138","Tree Connect Response"
"216","1.798953","192.168.1.216","192.168.1.2","SMB2","178","Ioctl Request FSCTL_QUERY_NETWORK_INTERFACE_INFO"
"217","1.799100","192.168.1.2","192.168.1.216","SMB2","322","Ioctl Response FSCTL_QUERY_NETWORK_INTERFACE_INFO"
"218","1.799115","192.168.1.216","192.168.1.2","LDAP","191","SASL GSS-API Privacy: payload (73 bytes)"
"219","1.799303","192.168.1.2","192.168.1.216","LDAP","219","SASL GSS-API Privacy: payload (101 bytes)"
"220","1.799889","192.168.1.216","192.168.1.2","LDAP","248","SASL GSS-API Privacy: payload (130 bytes)"
"221","1.800185","192.168.1.2","192.168.1.216","LDAP","636","SASL GSS-API Privacy: payload (518 bytes)"
"222","1.800893","192.168.1.216","192.168.1.2","DNS","131","Standard query 0xe115 SRV _ldap._tcp.Default-First-Site-Name._sites.ForestDnsZones.spoonwatch.net"
"223","1.801120","192.168.1.2","192.168.1.216","DNS","195","Standard query response 0xe115 SRV _ldap._tcp.Default-First-Site-Name._sites.ForestDnsZones.spoonwatch.net SRV 0 100 389 spoonwatch-dc.spoonwatch.net A 192.168.1.2"
"224","1.805713","192.168.1.216","192.168.1.2","TCP","1514","49677  >  49667 [ACK] Seq=1 Ack=1 Win=2102272 Len=1460 [TCP segment of a reassembled PDU]"
"225","1.805716","192.168.1.216","192.168.1.2","DCERPC","772","Bind: call_id: 2, Fragment: Single, 3 context items: DRSUAPI V4.0 (32bit NDR), DRSUAPI V4.0 (64bit NDR), DRSUAPI V4.0 (6cb71c2c-9812-4540-0300-000000000000)"
"226","1.805879","192.168.1.2","192.168.1.216","TCP","54","49667  >  49677 [ACK] Seq=1 Ack=2179 Win=2102272 Len=0"
"227","1.806469","192.168.1.216","192.168.1.2","TCP","66","49675  >  135 [ACK] Seq=329 Ack=353 Win=262400 Len=0 SLE=85 SRE=353"
"228","1.806666","192.168.1.2","192.168.1.216","DCERPC","338","Bind_ack: call_id: 2, Fragment: Single, max_xmit: 5840 max_recv: 5840, 3 results: Provider rejection, Acceptance, Negotiate ACK"
"229","1.806868","192.168.1.216","192.168.1.2","TCP","66","49688  >  88 [SYN] Seq=0 Win=64240 Len=0 MSS=1460 WS=256 SACK_PERM=1"
"230","1.806977","192.168.1.216","192.168.1.2","TCP","1514","49681  >  49667 [ACK] Seq=1 Ack=1 Win=2102272 Len=1460 [TCP segment of a reassembled PDU]"
"231","1.806980","192.168.1.216","192.168.1.2","DCERPC","772","Bind: call_id: 3, Fragment: Single, 2 context items: DRSUAPI V4.0 (32bit NDR), DRSUAPI V4.0 (64bit NDR)"
"232","1.807012","192.168.1.2","192.168.1.216","TCP","66","88  >  49688 [SYN, ACK] Seq=0 Ack=1 Win=65535 Len=0 MSS=1460 WS=256 SACK_PERM=1"
"233","1.807171","192.168.1.216","192.168.1.2","TCP","54","49688  >  88 [ACK] Seq=1 Ack=1 Win=262656 Len=0"
"234","1.807196","192.168.1.216","192.168.1.2","TCP","1514","49688  >  88 [ACK] Seq=1 Ack=1 Win=262656 Len=1460 [TCP segment of a reassembled PDU]"
"235","1.807197","192.168.1.216","192.168.1.2","KRB5","464","TGS-REQ"
"236","1.807202","192.168.1.2","192.168.1.216","TCP","54","49667  >  49681 [ACK] Seq=1 Ack=2179 Win=2102272 Len=0"
"237","1.807366","192.168.1.216","192.168.1.2","DCERPC","274","Alter_context: call_id: 2, Fragment: Single, 1 context items: DRSUAPI V4.0 (64bit NDR)"
"238","1.807513","192.168.1.2","192.168.1.216","TCP","54","88  >  49688 [ACK] Seq=1 Ack=1871 Win=2102272 Len=0"
"239","1.807984","192.168.1.2","192.168.1.216","DCERPC","159","Alter_context_resp: call_id: 2, Fragment: Single, max_xmit: 5840 max_recv: 5840, 1 results: Acceptance"
"240","1.808188","192.168.1.2","192.168.1.216","DCERPC","314","Bind_ack: call_id: 3, Fragment: Single, max_xmit: 5840 max_recv: 5840, 2 results: Provider rejection, Acceptance"
"241","1.808277","192.168.1.216","192.168.1.2","DRSUAPI","322","DsBind request"
"242","1.808372","192.168.1.2","192.168.1.216","TCP","1514","88  >  49688 [ACK] Seq=1 Ack=1871 Win=2102272 Len=1460 [TCP segment of a reassembled PDU]"
"243","1.808376","192.168.1.2","192.168.1.216","KRB5","403","TGS-REP"
"244","1.808474","192.168.1.216","192.168.1.2","TCP","54","49688  >  88 [ACK] Seq=1871 Ack=1810 Win=262656 Len=0"
"245","1.808503","192.168.1.216","192.168.1.2","DCERPC","274","Alter_context: call_id: 3, Fragment: Single, 1 context items: DRSUAPI V4.0 (64bit NDR)"
"246","1.808654","192.168.1.2","192.168.1.216","DRSUAPI","258","DsBind response"
"247","1.808659","192.168.1.216","192.168.1.2","TCP","54","49688  >  88 [FIN, ACK] Seq=1871 Ack=1810 Win=262656 Len=0"
"248","1.808815","192.168.1.2","192.168.1.216","TCP","54","88  >  49688 [ACK] Seq=1810 Ack=1872 Win=2102272 Len=0"
"249","1.808821","192.168.1.2","192.168.1.216","DCERPC","159","Alter_context_resp: call_id: 3, Fragment: Single, max_xmit: 5840 max_recv: 5840, 1 results: Acceptance"
"250","1.808899","192.168.1.2","192.168.1.216","TCP","54","88  >  49688 [RST, ACK] Seq=1810 Ack=1872 Win=0 Len=0"
"251","1.809004","192.168.1.216","192.168.1.2","DRSUAPI","322","DsCrackNames request"
"252","1.809271","192.168.1.216","192.168.1.2","DRSUAPI","258","DsBind request"
"253","1.809378","192.168.1.2","192.168.1.216","DRSUAPI","434","DsCrackNames response"
"254","1.809543","192.168.1.2","192.168.1.216","DRSUAPI","258","DsBind response"
"255","1.809568","192.168.1.216","192.168.1.2","DRSUAPI","322","DsCrackNames request"
"256","1.809871","192.168.1.216","192.168.1.2","DRSUAPI","322","DsCrackNames request"
"257","1.809881","192.168.1.2","192.168.1.216","DRSUAPI","402","DsCrackNames response"
"258","1.809925","192.168.1.216","192.168.1.2","TCP","1514","49668  >  389 [ACK] Seq=351 Ack=2774 Win=2102272 Len=1460 [TCP segment of a reassembled PDU]"
"259","1.809929","192.168.1.216","192.168.1.2","LDAP","651","bindRequest(4) ""<ROOT>"" sasl "
"260","1.810098","192.168.1.2","192.168.1.216","TCP","54","389  >  49668 [ACK] Seq=2774 Ack=2408 Win=2102272 Len=0"
"261","1.810102","192.168.1.216","192.168.1.2","DRSUAPI","194","DsUnbind request"
"262","1.810329","192.168.1.2","192.168.1.216","DRSUAPI","194","DsUnbind response"
"263","1.810405","192.168.1.2","192.168.1.216","DRSUAPI","434","DsCrackNames response"
"264","1.810605","192.168.1.216","192.168.1.2","DRSUAPI","194","DsUnbind request"
"265","1.810790","192.168.1.2","192.168.1.216","DRSUAPI","194","DsUnbind response"
"266","1.810918","192.168.1.2","192.168.1.216","LDAP","264","bindResponse(4) success "
"267","1.810990","192.168.1.216","192.168.1.2","EPM","222","Map request, DRSUAPI, 32bit NDR"
"268","1.811296","192.168.1.2","192.168.1.216","EPM","226","Map response, DRSUAPI, 32bit NDR"
"269","1.811788","192.168.1.216","192.168.1.2","TCP","1514","49677  >  49667 [ACK] Seq=3343 Ack=1462 Win=2102272 Len=1460 [TCP segment of a reassembled PDU]"
"270","1.811792","192.168.1.216","192.168.1.2","DCERPC","684","Alter_context: call_id: 9, Fragment: Single, 1 context items: DRSUAPI V4.0 (64bit NDR)"
"271","1.811951","192.168.1.2","192.168.1.216","TCP","54","49667  >  49677 [ACK] Seq=1462 Ack=5433 Win=2102272 Len=0"
"272","1.812371","192.168.1.2","192.168.1.216","DCERPC","286","Alter_context_resp: call_id: 9, Fragment: Single, max_xmit: 5840 max_recv: 5840, 1 results: Acceptance"
"273","1.812611","192.168.1.216","192.168.1.2","DCERPC","274","Alter_context: call_id: 9, Fragment: Single, 1 context items: DRSUAPI V4.0 (64bit NDR)"
"274","1.812739","192.168.1.216","192.168.1.2","LDAP","97","SASL GSS-API Integrity: unbindRequest(5) "
"275","1.812959","192.168.1.2","192.168.1.216","TCP","54","389  >  49668 [RST, ACK] Seq=2984 Ack=2451 Win=0 Len=0"
"276","1.812969","192.168.1.216","192.168.1.2","TCP","54","49668  >  389 [FIN, ACK] Seq=2451 Ack=2984 Win=2102016 Len=0"
"277","1.813084","192.168.1.2","192.168.1.216","DCERPC","159","Alter_context_resp: call_id: 9, Fragment: Single, max_xmit: 5840 max_recv: 5840, 1 results: Acceptance"
"278","1.813173","192.168.1.2","192.168.1.216","TCP","54","389  >  49668 [RST] Seq=2984 Win=0 Len=0"
"279","1.813337","192.168.1.216","192.168.1.2","DRSUAPI","258","DsBind request"
"280","1.813558","192.168.1.2","192.168.1.216","DRSUAPI","258","DsBind response"
"281","1.815125","192.168.1.216","192.168.1.2","CLDAP","243","searchRequest(12) ""<ROOT>"" baseObject "
"282","1.815421","192.168.1.2","192.168.1.216","CLDAP","236","searchResEntry(12) ""<ROOT>"" searchResDone(12) success  [1 result]"
"283","1.816227","192.168.1.216","192.168.1.2","DRSUAPI","338","Unknown operation 30 request"
"284","1.816515","192.168.1.2","192.168.1.216","DRSUAPI","210","Unknown operation 30 response"
"285","1.818632","192.168.1.216","192.168.1.2","DRSUAPI","194","DsUnbind request"
"286","1.818830","192.168.1.2","192.168.1.216","DRSUAPI","194","DsUnbind response"
"287","1.822142","192.168.1.216","192.168.1.2","TCP","66","49676  >  49676 [ACK] Seq=1993 Ack=1385 Win=261376 Len=0 SLE=385 SRE=1385"
"288","1.822180","192.168.1.216","192.168.1.2","TCP","66","49670  >  445 [ACK] Seq=4302 Ack=1177 Win=2100992 Len=0 SLE=909 SRE=1177"
"289","1.830321","192.168.1.216","192.168.1.2","SMB2","182","Ioctl Request FSCTL_DFS_GET_REFERRALS, File: "
"290","1.830701","192.168.1.2","192.168.1.216","SMB2","270","Ioctl Response FSCTL_DFS_GET_REFERRALS"
"291","1.837857","192.168.1.216","192.168.1.2","TCP","66","49686  >  389 [ACK] Seq=2751 Ack=3731 Win=261632 Len=0 SLE=3149 SRE=3731"
"292","1.837890","192.168.1.216","192.168.1.2","TCP","66","49681  >  49667 [ACK] Seq=3011 Ack=1090 Win=2101248 Len=0 SLE=950 SRE=1090"
"293","1.843801","192.168.1.216","192.168.1.2","SMB2","182","Ioctl Request FSCTL_DFS_GET_REFERRALS, File: "
"294","1.844207","192.168.1.2","192.168.1.216","SMB2","270","Ioctl Response FSCTL_DFS_GET_REFERRALS"
"295","1.853404","192.168.1.216","192.168.1.2","TCP","66","49677  >  49667 [ACK] Seq=6281 Ack=2299 Win=2101504 Len=0 SLE=2159 SRE=2299"
"296","1.864955","192.168.1.216","192.168.1.2","TCP","54","49674  >  135 [ACK] Seq=665 Ack=625 Win=262144 Len=0"
"297","1.884658","192.168.1.216","192.168.1.2","TCP","66","49670  >  445 [ACK] Seq=4558 Ack=1609 Win=2102272 Len=0 SLE=1393 SRE=1609"
"298","1.912712","192.168.1.216","192.168.1.2","TCP","66","49689  >  135 [SYN] Seq=0 Win=64240 Len=0 MSS=1460 WS=256 SACK_PERM=1"
"299","1.912945","192.168.1.2","192.168.1.216","TCP","66","135  >  49689 [SYN, ACK] Seq=0 Ack=1 Win=65535 Len=0 MSS=1460 WS=256 SACK_PERM=1"
"300","1.913150","192.168.1.216","192.168.1.2","TCP","54","49689  >  135 [ACK] Seq=1 Ack=1 Win=2102272 Len=0"
"301","1.914637","192.168.1.216","192.168.1.2","DCERPC","214","Bind: call_id: 2, Fragment: Single, 3 context items: EPMv4 V3.0 (32bit NDR), EPMv4 V3.0 (64bit NDR), EPMv4 V3.0 (6cb71c2c-9812-4540-0300-000000000000)"
"302","1.914784","192.168.1.2","192.168.1.216","DCERPC","162","Bind_ack: call_id: 2, Fragment: Single, max_xmit: 5840 max_recv: 5840, 3 results: Provider rejection, Acceptance, Negotiate ACK"
"303","1.914984","192.168.1.216","192.168.1.2","EPM","222","Map request, DRSUAPI, 32bit NDR"
"304","1.915233","192.168.1.2","192.168.1.216","EPM","226","Map response, DRSUAPI, 32bit NDR"
"305","1.926469","192.168.1.216","192.168.1.2","TCP","66","49690  >  49667 [SYN] Seq=0 Win=64240 Len=0 MSS=1460 WS=256 SACK_PERM=1"
"306","1.926699","192.168.1.2","192.168.1.216","TCP","66","49667  >  49690 [SYN, ACK] Seq=0 Ack=1 Win=65535 Len=0 MSS=1460 WS=256 SACK_PERM=1"
"307","1.926861","192.168.1.216","192.168.1.2","TCP","54","49690  >  49667 [ACK] Seq=1 Ack=1 Win=262656 Len=0"
"308","1.927939","192.168.1.216","192.168.1.2","TCP","66","49691  >  88 [SYN] Seq=0 Win=64240 Len=0 MSS=1460 WS=256 SACK_PERM=1"
"309","1.928104","192.168.1.2","192.168.1.216","TCP","66","88  >  49691 [SYN, ACK] Seq=0 Ack=1 Win=65535 Len=0 MSS=1460 WS=256 SACK_PERM=1"
"310","1.928116","192.168.1.216","192.168.1.2","TCP","66","49692  >  389 [SYN] Seq=0 Win=64240 Len=0 MSS=1460 WS=256 SACK_PERM=1"
"311","1.928275","192.168.1.216","192.168.1.2","TCP","54","49691  >  88 [ACK] Seq=1 Ack=1 Win=2102272 Len=0"
"312","1.928332","192.168.1.2","192.168.1.216","TCP","66","389  >  49692 [SYN, ACK] Seq=0 Ack=1 Win=65535 Len=0 MSS=1460 WS=256 SACK_PERM=1"
"313","1.928344","192.168.1.216","192.168.1.2","TCP","1514","49691  >  88 [ACK] Seq=1 Ack=1 Win=2102272 Len=1460 [TCP segment of a reassembled PDU]"
"314","1.928347","192.168.1.216","192.168.1.2","KRB5","448","TGS-REQ"
"315","1.928487","192.168.1.216","192.168.1.2","TCP","54","49692  >  389 [ACK] Seq=1 Ack=1 Win=2102272 Len=0"
"316","1.928556","192.168.1.2","192.168.1.216","TCP","54","88  >  49691 [ACK] Seq=1 Ack=1855 Win=2102272 Len=0"
"317","1.929587","192.168.1.2","192.168.1.216","TCP","1514","88  >  49691 [ACK] Seq=1 Ack=1855 Win=2102272 Len=1460 [TCP segment of a reassembled PDU]"
"318","1.929590","192.168.1.2","192.168.1.216","KRB5","387","TGS-REP"
"319","1.929719","192.168.1.216","192.168.1.2","TCP","54","49691  >  88 [ACK] Seq=1855 Ack=1794 Win=2102272 Len=0"
"320","1.929799","192.168.1.216","192.168.1.2","TCP","54","49691  >  88 [FIN, ACK] Seq=1855 Ack=1794 Win=2102272 Len=0"
"321","1.929910","192.168.1.2","192.168.1.216","TCP","54","88  >  49691 [ACK] Seq=1794 Ack=1856 Win=2102272 Len=0"
"322","1.929961","192.168.1.2","192.168.1.216","TCP","54","88  >  49691 [RST, ACK] Seq=1794 Ack=1856 Win=0 Len=0"
"323","1.930273","192.168.1.216","192.168.1.2","TCP","1514","49690  >  49667 [ACK] Seq=1 Ack=1 Win=262656 Len=1460 [TCP segment of a reassembled PDU]"
"324","1.930277","192.168.1.216","192.168.1.2","DCERPC","721","Bind: call_id: 2, Fragment: Single, 3 context items: DRSUAPI V4.0 (32bit NDR), DRSUAPI V4.0 (64bit NDR), DRSUAPI V4.0 (6cb71c2c-9812-4540-0300-000000000000)"
"325","1.930433","192.168.1.2","192.168.1.216","TCP","54","49667  >  49690 [ACK] Seq=1 Ack=2128 Win=2102272 Len=0"
"326","1.930986","192.168.1.2","192.168.1.216","DCERPC","338","Bind_ack: call_id: 2, Fragment: Single, max_xmit: 5840 max_recv: 5840, 3 results: Provider rejection, Acceptance, Negotiate ACK"
"327","1.931603","192.168.1.216","192.168.1.2","DCERPC","274","Alter_context: call_id: 2, Fragment: Single, 1 context items: DRSUAPI V4.0 (64bit NDR)"
"328","1.931886","192.168.1.2","192.168.1.216","DCERPC","159","Alter_context_resp: call_id: 2, Fragment: Single, max_xmit: 5840 max_recv: 5840, 1 results: Acceptance"
"329","1.933460","192.168.1.216","192.168.1.2","DRSUAPI","322","DsBind request"
"330","1.933702","192.168.1.2","192.168.1.216","DRSUAPI","258","DsBind response"
"331","1.933923","192.168.1.216","192.168.1.2","DRSUAPI","482","DsWriteAccountSpn request"
"332","1.934285","192.168.1.216","192.168.1.2","TCP","54","49692  >  389 [FIN, ACK] Seq=1 Ack=1 Win=2102272 Len=0"
